date	review_id	sentiment	label_id	input_ids	review_body
2022-05-05T11:10:57Z	1925	0	1	[0, 42370, 1035, 9304, 454, 939, 770, 7, 4716, 127, 2335, 8, 51, 12256, 78, 86, 2498, 106, 4, 2, 1, 1, 1, 1, 1, 1, 1, 1, 1, 1, 1, 1, 1, 1, 1, 1, 1, 1, 1, 1, 1, 1, 1, 1, 1, 1, 1, 1, 1, 1, 1, 1, 1, 1, 1, 1, 1, 1, 1, 1, 1, 1, 1, 1, 1, 1, 1, 1, 1, 1, 1, 1, 1, 1, 1, 1, 1, 1, 1, 1, 1, 1, 1, 1, 1, 1, 1, 1, 1, 1, 1, 1, 1, 1, 1, 1, 1, 1, 1, 1, 1, 1, 1, 1, 1, 1, 1, 1, 1, 1, 1, 1, 1, 1, 1, 1, 1, 1, 1, 1, 1, 1, 1, 1, 1, 1, 1, 1]	Perfect summer pants until i wanted to pet my dog and they ripped first time wearing them.
2022-05-05T11:10:57Z	4329	-1	0	[0, 100, 770, 7, 657, 42, 23204, 4, 5, 3195, 16, 12058, 1437, 5, 6184, 5425, 1437, 24, 16, 3793, 8, 3279, 1437, 8, 74, 33, 1613, 19, 98, 171, 383, 4, 53, 5, 847, 16, 11522, 4, 4412, 5, 21764, 32, 169, 350, 380, 1437, 442, 162, 356, 2649, 24616, 225, 8, 127, 3701, 356, 1307, 4, 5, 809, 21, 10, 828, 2233, 219, 53, 14, 74, 33, 57, 173, 868, 114, 5, 3701, 56, 57, 2340, 4, 350, 1099, 4, 2, 1, 1, 1, 1, 1, 1, 1, 1, 1, 1, 1, 1, 1, 1, 1, 1, 1, 1, 1, 1, 1, 1, 1, 1, 1, 1, 1, 1, 1, 1, 1, 1, 1, 1, 1, 1, 1, 1, 1, 1, 1, 1, 1, 1, 1]	I wanted to love this sweater. the color is gorgeous  the pattern unusual  it is soft and warm  and would have gone with so many things. but the cut is awful. mainly the sleeves are way too big  making me look misshapen and my arms look huge. the body was a bit boxy but that would have been workable if the arms had been normal. too bad.
2022-05-05T11:10:57Z	4737	0	1	[0, 100, 657, 5, 6184, 9, 5, 1275, 73, 41964, 3588, 4, 939, 2162, 42, 804, 13, 29521, 1334, 4, 939, 437, 29673, 4567, 4, 939, 1299, 6664, 35187, 4, 5, 3588, 2564, 4, 939, 437, 195, 108, 245, 113, 7714, 1119, 8, 939, 2162, 5, 3023, 29, 4, 24, 16, 95, 45, 34203, 15, 127, 5120, 4, 939, 1415, 101, 939, 56, 380, 28097, 1437, 5, 13977, 1971, 21, 45, 2351, 10, 13977, 13, 162, 8, 939, 240, 14, 734, 939, 770, 7, 489, 24, 53, 16748, 939, 40, 28, 3357, 24, 4, 127, 1623, 1507, 939, 197, 671, 24, 4, 2, 1, 1, 1, 1, 1, 1, 1, 1, 1, 1, 1, 1, 1, 1, 1, 1, 1, 1, 1, 1, 1, 1, 1, 1, 1]	"I love the pattern of the red/orange dress. i bought this online for easter. i'm bummed. i felt frumpy. the dress fit. i'm 5'5"" athletic build and i bought the xs. it is just not flattering on my frame. i looked like i had big hips  the waist band was not creating a waist for me and i need that... i wanted to keep it but sadly i will be returning it. my husband agreed i should return it."
2022-05-05T11:10:57Z	4065	0	1	[0, 133, 299, 21, 182, 2579, 8, 939, 6640, 5, 1468, 4, 127, 936, 21, 562, 24, 15, 19, 5, 740, 5602, 145, 7391, 7, 5, 299, 4, 24, 362, 162, 10, 150, 7, 1955, 24, 66, 4, 8, 13, 14, 1219, 1937, 939, 1835, 24, 4, 2, 1, 1, 1, 1, 1, 1, 1, 1, 1, 1, 1, 1, 1, 1, 1, 1, 1, 1, 1, 1, 1, 1, 1, 1, 1, 1, 1, 1, 1, 1, 1, 1, 1, 1, 1, 1, 1, 1, 1, 1, 1, 1, 1, 1, 1, 1, 1, 1, 1, 1, 1, 1, 1, 1, 1, 1, 1, 1, 1, 1, 1, 1, 1, 1, 1, 1, 1, 1, 1, 1, 1, 1, 1, 1, 1, 1, 1, 1, 1, 1]	The top was very nice and i liked the material. my problem was getting it on with the cami being attached to the top. it took me a while to figure it out. and for that reason alone i returned it.
2022-05-05T11:10:57Z	10446	-1	0	[0, 100, 2740, 42, 23204, 11, 5, 6907, 3195, 11, 10, 650, 8, 3023, 23115, 1437, 11, 645, 7, 192, 61, 21, 5, 275, 2564, 4, 939, 21, 269, 546, 556, 7, 562, 24, 142, 24, 1415, 98, 372, 804, 111, 101, 24, 56, 10, 2579, 3041, 1437, 5, 11962, 43805, 8, 21, 10, 205, 914, 13, 10, 6907, 8, 10521, 16576, 14, 939, 33, 4, 939, 21, 269, 5779, 1437, 5, 23204, 630, 75, 3041, 101, 24, 473, 11, 5, 2170, 111, 24, 761, 9, 1087, 2176, 66, 11, 5, 760, 8, 124, 8, 965, 75, 34203, 4, 939, 33, 10, 650, 1119, 1437, 8, 1437, 13542, 1437, 939, 2333, 356, 205, 11, 24043, 11837, 2, 1, 1, 1, 1, 1, 1, 1, 1, 1, 1, 1]	I ordered this sweater in the pink color in a small and xsmall  in order to see which was the best fit. i was really looking forward to getting it because it looked so great online - like it had a nice flow  the cute zipper and was a good match for a pink and grey skirt that i have. i was really disappointed  the sweater doesn't flow like it does in the picture - it kind of billows out in the front and back and isn't flattering. i have a small build  and  frankly  i usually look good in sweaters
